{
  "kind": "ModuleRegistry",
  "schemaVersion": "0.1.0",
  "registryVersion": "0.1.0",
  "modules": [
    {
      "kind": "ModuleDefinition", "schemaVersion": "0.1.0", "id": "core", "version": "0.1.0",
      "title": "Project OS core",
      "description": "Authority, profile, state, evidence vocabulary, decisions, handoffs, baseline security/testing and coding-agent adapters. Included in every generated OS.",
      "domain": "orchestrator", "phase": "P0", "status": "EXPERIMENTAL",
      "applicability": { "mode": "ALWAYS" },
      "capabilities": [
        "product.idea_validation", "product.product_strategy", "product.prd_generator", "product.user_stories", "product.jtbd",
        "product.roadmap", "product.feature_prioritization", "product.requirements_traceability",
        "security.threat_model", "security.data_classification", "security.secret_scanning", "security.prompt_injection",
        "quality.unit_testing", "quality.release_gates", "docs.readme", "docs.architecture_docs", "docs.changelog",
        "team.task_planning", "team.handoffs", "team.code_review", "team.sprints", "team.meeting_summaries",
        "ai.claude_code", "ai.codex", "ai.cursor_adapter", "business.cost_model"
      ],
      "dependsOn": [], "conflictsWith": [],
      "requiredFiles": [
        { "path": "AGENTS.md", "template": "core/AGENTS.md" },
        { "path": "PROJECT.md", "template": "core/PROJECT.md" },
        { "path": "PRODUCT_REQUIREMENTS.md", "template": "core/PRODUCT_REQUIREMENTS.md" },
        { "path": "ARCHITECTURE.md", "template": "core/ARCHITECTURE.md" },
        { "path": "SECURITY.md", "template": "core/SECURITY.md" },
        { "path": "EXTERNAL_ACTIONS.md", "template": "core/EXTERNAL_ACTIONS.md" },
        { "path": "RESEARCH_POLICY.md", "template": "core/RESEARCH_POLICY.md" },
        { "path": "DECISIONS.md", "template": "core/DECISIONS.md" },
        { "path": "state/CURRENT_STATE.md", "template": "core/state/CURRENT_STATE.md" },
        { "path": "state/NEXT_ACTIONS.md", "template": "core/state/NEXT_ACTIONS.md" },
        { "path": "state/IMPLEMENTATION_INVENTORY.md", "template": "core/state/IMPLEMENTATION_INVENTORY.md" },
        { "path": ".project-os/manifest.json", "template": "core/manifest.json" },
        { "path": ".project-os/profile.json", "template": "core/profile.json" },
        { "path": ".project-os/permissions.json", "template": "core/permissions.json" }
      ],
      "requiredAgents": ["orchestrator", "product-agent", "architect-agent", "qa-agent", "security-agent", "audit-agent"],
      "requiredGates": ["G0", "G1", "G2", "G3", "G4"],
      "adapterContributions": [
        { "adapter": "claude", "template": "adapters/claude/CLAUDE.md" },
        { "adapter": "claude", "template": "adapters/claude/CLAUDE_BOOTSTRAP.md" },
        { "adapter": "codex", "template": "adapters/codex/CODEX_BOOTSTRAP.md" },
        { "adapter": "cursor", "template": "adapters/cursor/project-os.mdc" },
        { "adapter": "generic", "template": "adapters/generic/BOOTSTRAP.md" }
      ],
      "riskFactors": [], "researchTopics": []
    },
    {
      "kind": "ModuleDefinition", "schemaVersion": "0.1.0", "id": "web-saas", "version": "0.1.0",
      "title": "Web application / SaaS",
      "description": "Web app engineering: data, auth, tenancy, jobs, deployment, observability and web security.",
      "domain": "engineering", "phase": "P0", "status": "EXPERIMENTAL",
      "applicability": {
        "mode": "RULES", "onUnknown": "RAISE_DECISION",
        "any": [
          { "field": "productTypes", "operator": "INCLUDES_ANY", "values": ["WEB_SAAS", "MARKETPLACE", "INTERNAL_TOOL", "ECOMMERCE", "REALTIME_APP", "CONTENT_SITE"] },
          { "field": "platformTargets", "operator": "INCLUDES_ANY", "values": ["WEB"] }
        ]
      },
      "capabilities": [
        "development.web_apps", "development.pwa", "development.realtime_apps", "development.internal_tools", "development.marketplaces",
        "backend.database", "backend.auth", "backend.authorization", "backend.multitenancy", "backend.storage", "backend.email",
        "backend.rate_limiting", "backend.background_jobs", "backend.migrations", "backend.webhooks", "backend.queues", "backend.cron",
        "backend.cache", "backend.search", "backend.notifications",
        "infra.ci_cd", "infra.environments", "infra.deployment", "infra.secrets", "infra.logging", "infra.observability", "infra.backups",
        "infra.alerting", "infra.metrics", "infra.tracing", "infra.feature_flags", "infra.cdn", "infra.dns_domains", "infra.disaster_recovery", "infra.cost_monitoring",
        "security.owasp", "security.tenant_isolation", "security.dependency_security", "security.audit_log", "security.retention", "security.deletion",
        "security.incident_response", "security.vulnerability_management",
        "quality.integration_testing", "quality.e2e_testing", "quality.security_testing", "quality.load_testing", "quality.rollback"
      ],
      "dependsOn": [], "conflictsWith": [],
      "requiredFiles": [
        { "path": "engineering/WEB_APP.md", "template": "web-saas/WEB_APP.md" },
        { "path": "engineering/AUTH_AND_TENANCY.md", "template": "web-saas/AUTH_AND_TENANCY.md" },
        { "path": "engineering/DEPLOYMENT.md", "template": "web-saas/DEPLOYMENT.md" }
      ],
      "requiredAgents": ["frontend-agent", "backend-agent", "database-agent", "auth-agent", "devops-agent"],
      "requiredGates": ["G3", "G5", "G6"],
      "adapterContributions": [], "riskFactors": [], "researchTopics": ["TECHNICAL"]
    },
    {
      "kind": "ModuleDefinition", "schemaVersion": "0.1.0", "id": "premium-ux", "version": "0.1.0",
      "title": "Premium experience",
      "description": "Design system, tokens, motion, accessibility, responsive behaviour, state design, performance budgets and design review for any user-facing surface.",
      "domain": "engineering", "phase": "P0", "status": "EXPERIMENTAL",
      "applicability": {
        "mode": "RULES", "onUnknown": "INCLUDE",
        "any": [ { "field": "platformTargets", "operator": "INCLUDES_ANY", "values": ["WEB", "IOS", "ANDROID", "MACOS", "WINDOWS", "LINUX", "BROWSER_EXTENSION"] } ]
      },
      "capabilities": [
        "design.design_system", "design.design_tokens", "design.responsive_design", "design.motion", "design.microinteractions",
        "design.accessibility", "design.iconography", "design.illustration", "design.data_visualization", "design.design_qa", "design.wireframes",
        "design.prototyping", "design.ux_research", "design.usability_testing",
        "quality.accessibility_testing", "quality.visual_regression", "quality.cross_browser", "quality.device_testing"
      ],
      "dependsOn": [], "conflictsWith": [],
      "requiredFiles": [
        { "path": "design/EXPERIENCE_SYSTEM.md", "template": "premium-ux/EXPERIENCE_SYSTEM.md" },
        { "path": "design/tokens.json", "template": "premium-ux/tokens.json" },
        { "path": "gates/DESIGN_REVIEW.md", "template": "premium-ux/DESIGN_REVIEW.md" }
      ],
      "requiredAgents": ["frontend-agent", "qa-agent"],
      "requiredGates": ["G4", "DESIGN_REVIEW"],
      "adapterContributions": [], "riskFactors": [], "researchTopics": []
    },
    {
      "kind": "ModuleDefinition", "schemaVersion": "0.1.0", "id": "ai", "version": "0.1.0",
      "title": "AI features and runtime",
      "description": "Provider-neutral model use, routing, token budgets, evals, guardrails, prompt-injection defence and AI cost review.",
      "domain": "engineering", "phase": "P0", "status": "EXPERIMENTAL",
      "applicability": { "mode": "RULES", "onUnknown": "RAISE_DECISION", "all": [ { "field": "ai.usesAI", "operator": "IS_TRUE" } ] },
      "capabilities": [
        "ai.model_routing", "ai.agents", "ai.tool_use", "ai.rag", "ai.embeddings", "ai.vector_search", "ai.evals", "ai.guardrails",
        "ai.prompt_registry", "ai.context_engineering", "ai.token_harness", "ai.caching", "ai.fallbacks", "ai.structured_output",
        "ai.human_approval", "ai.mcp_connectors"
      ],
      "dependsOn": [], "conflictsWith": [],
      "requiredFiles": [
        { "path": "engineering/AI_RUNTIME.md", "template": "ai/AI_RUNTIME.md" },
        { "path": "engineering/AI_COST_BUDGETS.md", "template": "ai/AI_COST_BUDGETS.md" },
        { "path": "engineering/AI_EVALS.md", "template": "ai/AI_EVALS.md" }
      ],
      "requiredAgents": ["ai-agent", "security-agent"],
      "requiredGates": ["G3", "G4", "COST_REVIEW"],
      "adapterContributions": [], "riskFactors": ["AI_PROMPT_INJECTION", "AI_DATA_EXPOSURE", "AI_COST_OVERRUN"], "researchTopics": ["TECHNICAL"]
    },
    {
      "kind": "ModuleDefinition", "schemaVersion": "0.1.0", "id": "payments", "version": "0.1.0",
      "title": "Payments and billing",
      "description": "Payment integration boundaries, webhooks, billing operations, pricing evidence and unit economics.",
      "domain": "engineering", "phase": "P0", "status": "EXPERIMENTAL",
      "applicability": { "mode": "RULES", "onUnknown": "RAISE_DECISION", "all": [ { "field": "payments.needed", "operator": "IS_TRUE" } ] },
      "capabilities": ["marketing.pricing", "marketing.monetization", "backend.webhooks", "security.audit_log", "analytics.unit_economics"],
      "dependsOn": [], "conflictsWith": [],
      "requiredFiles": [
        { "path": "engineering/PAYMENTS.md", "template": "payments/PAYMENTS.md" },
        { "path": "operations/BILLING_OPERATIONS.md", "template": "payments/BILLING_OPERATIONS.md" }
      ],
      "requiredAgents": ["backend-agent", "security-agent", "operations-agent", "pricing-agent"],
      "requiredGates": ["G3", "G5"],
      "adapterContributions": [], "riskFactors": ["PAYMENT_PROCESSING"], "researchTopics": ["PRICING"]
    },
    {
      "kind": "ModuleDefinition", "schemaVersion": "0.1.0", "id": "mobile", "version": "0.1.0",
      "title": "Mobile apps",